{
  "sample_id": "P001-S08",
  "publicly_available_data_fields": [
    "sets",
    "sensor_target_detection_probability",
    "weapon_target_conditional_destruction_probability",
    "sensor_target_assignment_cost",
    "weapon_target_assignment_cost",
    "minimum_desired_destruction_probability"
  ],
  "publicly_explained_parameter_semantics": [
    "sets",
    "sensor_target_detection_probability",
    "weapon_target_conditional_destruction_probability",
    "sensor_target_assignment_cost",
    "weapon_target_assignment_cost",
    "minimum_desired_destruction_probability"
  ],
  "withheld_aggregation_rules": [],
  "withheld_modeling_choices": [],
  "required_elements": [
    "SET:S",
    "SET:W",
    "SET:T",
    "PARAM:p_ik",
    "PARAM:q_jk",
    "PARAM:a_ik",
    "PARAM:b_jk",
    "PARAM:u",
    "VAR:x_ik",
    "VAR:y_jk",
    "DERIVED:A_k",
    "DERIVED:B_k",
    "DERIVED:D_k",
    "OBJ:OBJ",
    "CON:C1",
    "CON:C2",
    "CON:C3",
    "CON:C4",
    "CON:C5",
    "CON:C6"
  ],
  "optional_or_parameterizable_elements": [],
  "unsupported_elements": [
    "SEMANTIC:unsupported_target_threat",
    "SEMANTIC:unsupported_time_window",
    "SEMANTIC:unsupported_generic_inventory"
  ],
  "expected_agent_behavior": "Use only the public scenario and data files to construct a model at the disclosed level.",
  "scoring_denominator_policy": "Only required_elements enter the mandatory denominator for this disclosure level."
}
